{"schema":"grampy-quality-manifest.v1","run_id":"57f5d61aeab0c141b511a1e8","status":"complete","decoder":{"version":"0.2.0-reference","configuration":{"block_samples":262144,"center_hz":null,"mode":"auto","orientation":"unknown","persistent_intermediates":false,"persistent_tone_policy":"measure","picture_boundary_estimator":"unified_grid","picture_component_estimator":"bounded_correlation","picture_component_window":"full_hann","picture_filter_profile":"response_matched","picture_max_in_flight_ranges":1,"picture_range_components":16384,"picture_range_workers":1,"pipeline_organization":"supported_hybrid","trace_level":"none"}},"input":{"metadata_sha256":"9c08daa27d07c5f695017e85e0308cd2c76b33d2206d2da0f386a618c3ea64df","data_sha256":"29fded4ea390d8b8483898904847122e1fbca6a903b24244493512b5cf950951","sample_rate_hz":16000.0,"requested_interval":{"start":0,"stop":28800000}},"grid":{"origin_sample":0,"interval_seconds":1,"point_count":1800},"columns":["signal_dbfs","noise_dbfs","decode_confidence"],"points":[[null,-71.832,null],[-71.007,-71.717,null],[-69.858,-71.792,null],[-72.642,-73.303,null],[null,-70.722,null],[null,-72.514,null],[null,-73.46,null],[null,-72.063,null],[null,-70.26,null],[null,-70.479,null],[null,-69.978,null],[null,-68.021,null],[null,-71.764,null],[null,-71.361,null],[null,-72.015,null],[null,-69.919,null],[null,-70.728,null],[null,-69.286,null],[null,-69.181,null],[null,-69.134,null],[null,-68.441,null],[null,-71.759,null],[null,-70.849,null],[-73.386,-71.155,null],[-69.229,-68.297,null],[-71.309,-69.668,null],[null,-73.706,null],[null,-73.094,null],[null,-72.727,null],[null,-73.044,null],[null,-72.8,null],[null,-73.768,null],[null,-72.832,null],[null,-73.674,null],[null,-72.822,null],[-66.756,-70.435,null],[null,-69.861,null],[null,-70.66,null],[null,-68.052,null],[-72.795,-70.96,null],[-66.535,-69.366,null],[null,-70.2,null],[null,-70.587,null],[null,-67.112,null],[null,-69.873,null],[null,-68.446,null],[null,-68.444,null],[-67.549,-68.7,null],[null,-69.174,null],[null,-70.762,null],[-72.223,-71.396,null],[-67.803,-70.428,null],[-64.295,-69.699,null],[null,-67.73,null],[null,-71.337,null],[null,-69.494,null],[null,-70.762,null],[-71.721,-68.164,null],[null,-69.356,null],[-68.596,-68.248,null],[-74.009,-69.839,null],[null,-71.078,null],[null,-71.239,null],[null,-70.657,null],[-65.489,-68.088,null],[null,-74.055,null],[-77.473,-72.984,null],[-66.768,-68.177,null],[null,-72.232,null],[-78.601,-74.146,null],[-63.582,-70.48,null],[-58.535,-69.919,null],[-62.53,-67.895,null],[-67.005,-67.663,null],[null,-69.812,null],[null,-70.038,null],[-60.345,-68.025,null],[-61.298,-67.155,null],[-59.593,-66.469,null],[null,-71.155,null],[null,-70.034,null],[-71.228,-69.25,null],[-70.661,-70.521,null],[-69.514,-69.631,null],[-65.96,-69.174,null],[-67.764,-70.456,null],[null,-72.539,null],[null,-70.897,null],[-72.602,-70.683,null],[null,-68.05,null],[-66.849,-68.657,null],[-68.268,-71.485,null],[null,-70.593,null],[null,-67.304,null],[null,-66.669,null],[null,-65.244,null],[-67.207,-69.444,null],[null,-67.512,null],[null,-71.676,null],[null,-68.643,null],[-69.768,-68.302,null],[-59.558,-68.331,null],[-67.269,-72.182,null],[-67.421,-65.305,null],[null,-66.131,null],[-68.549,-71.446,null],[-70.012,-69.479,null],[null,-69.212,null],[null,-73.931,null],[-71.984,-70.388,null],[null,-69.393,null],[-76.036,-74.864,null],[-51.582,-74.078,null],[-50.866,-74.434,null],[null,-73.464,null],[null,-68.552,null],[-70.244,-69.924,null],[-74.487,-71.257,null],[-73.95,-72.642,null],[-48.324,-73.533,null],[-48.633,-74.364,0.912],[-53.778,-73.962,0.91],[-60.248,-74.284,0.872],[-54.238,-74.154,0.911],[-47.811,-73.419,0.965],[-45.684,-73.588,0.976],[-45.829,-73.469,0.985],[-47.843,-73.193,0.969],[-53.482,-74.445,0.927],[-55.628,-74.434,0.903],[-50.447,-74.088,0.941],[-47.046,-73.572,0.981],[-46.605,-73.917,0.985],[-48.777,-74.747,0.981],[-52.242,-74.803,0.96],[-55.854,-73.928,0.922],[-51.9,-74.745,0.953],[-47.58,-74.141,0.981],[-46.778,-73.918,0.981],[-48.716,-74.081,0.991],[-52.252,-73.868,0.968],[-53.831,-73.782,0.953],[-50.481,-74.412,0.974],[-47.926,-74.812,0.979],[-47.304,-74.347,0.988],[-48.962,-74.012,0.996],[-53.461,-74.492,0.979],[-57.226,-74.579,0.951],[-52.508,-74.703,0.973],[-49.155,-74.87,1.0],[-48.892,-74.838,1.0],[-49.472,-74.461,1.0],[-51.965,-74.783,1.0],[-55.982,-74.853,0.979],[-60.749,-74.71,0.957],[-57.643,-74.501,0.914],[-53.124,-74.875,0.919],[-52.088,-75.187,0.921],[-52.716,-74.752,0.921],[-53.717,-75.305,0.901],[-54.093,-74.765,0.878],[-55.193,-75.08,0.876],[-55.685,-74.748,0.891],[-55.1,-74.941,0.898],[-52.767,-74.535,0.894],[-51.273,-74.578,0.882],[-51.805,-74.361,0.886],[-55.181,-74.673,0.837],[-60.408,-75.0,0.786],[-56.134,-75.003,0.655],[-51.246,-74.568,0.799],[-49.933,-74.296,0.808],[-49.741,-74.572,0.826],[-52.927,-74.721,0.835],[-59.182,-74.854,0.832],[-55.695,-74.72,0.81],[-50.795,-74.612,0.806],[-49.128,-74.719,0.675],[-49.626,-74.772,0.693],[-51.028,-74.8,0.677],[-56.533,-75.012,0.773],[-57.807,-74.707,0.824],[-56.467,-74.563,0.852],[-52.881,-74.838,0.847],[-50.248,-74.751,0.864],[-49.583,-74.522,0.869],[-50.258,-75.348,0.864],[-53.063,-74.562,0.842],[-55.629,-74.943,0.826],[-56.216,-75.144,0.861],[-54.673,-74.376,0.86],[-51.39,-74.555,0.868],[-50.112,-74.568,0.864],[-50.327,-75.156,0.84],[-55.205,-74.764,null],[-59.035,-74.662,null],[-60.156,-74.881,0.925],[-61.016,-74.775,0.946],[-56.372,-75.336,0.966],[-53.226,-75.231,1.0],[-52.014,-74.946,1.0],[-52.701,-74.768,1.0],[-55.337,-75.008,1.0],[-57.708,-74.489,1.0],[-58.528,-75.727,0.996],[-55.664,-74.168,1.0],[-52.624,-75.167,1.0],[-50.943,-74.84,1.0],[-51.133,-74.272,1.0],[-55.279,-74.389,0.911],[-61.372,-75.063,0.833],[-52.717,-74.848,0.926],[-48.126,-74.706,1.0],[-46.933,-74.62,1.0],[-47.137,-75.011,1.0],[-48.263,-74.214,1.0],[-50.66,-74.534,0.987],[-53.338,-73.765,0.973],[-50.878,-74.237,0.988],[-48.245,-74.117,1.0],[-46.703,-74.353,1.0],[-45.912,-74.113,1.0],[-45.509,-73.374,1.0],[-46.22,-74.207,1.0],[-49.057,-73.967,0.998],[-51.034,-74.239,0.997],[-50.791,-74.602,0.995],[-48.176,-73.61,1.0],[-46.595,-74.042,1.0],[-46.372,-74.55,1.0],[-46.993,-74.113,1.0],[-49.528,-73.961,1.0],[-50.67,-74.355,1.0],[-51.275,-74.612,0.996],[-49.744,-74.346,1.0],[-48.288,-73.885,1.0],[-47.314,-74.482,1.0],[-48.052,-74.588,1.0],[-50.159,-74.56,1.0],[-52.948,-74.479,0.984],[-56.812,-74.543,0.947],[-51.927,-74.721,0.988],[-48.749,-73.803,1.0],[-47.64,-73.536,1.0],[-48.043,-74.163,1.0],[-50.021,-74.77,1.0],[-53.738,-74.426,1.0],[-55.792,-74.31,0.996],[-52.827,-74.602,1.0],[-50.484,-73.862,1.0],[-49.28,-74.245,1.0],[-49.266,-73.517,1.0],[-50.23,-74.081,1.0],[-51.532,-73.841,1.0],[-50.859,-74.274,1.0],[-49.627,-74.338,1.0],[-49.345,-74.178,1.0],[-50.359,-73.752,1.0],[-51.328,-74.047,1.0],[-51.701,-73.846,1.0],[-50.744,-74.208,1.0],[-49.432,-73.976,1.0],[-47.733,-73.556,1.0],[-47.196,-74.188,1.0],[-47.232,-74.055,1.0],[-48.157,-73.949,1.0],[-49.825,-73.589,1.0],[-57.579,-74.398,0.97],[-57.423,-74.17,0.955],[-51.088,-74.453,0.979],[-48.621,-73.703,1.0],[-47.436,-74.136,1.0],[-47.074,-73.603,1.0],[-46.781,-73.563,0.962],[-48.219,-74.485,0.941],[-49.979,-74.127,0.928],[-52.446,-74.429,0.873],[-59.861,-74.361,0.832],[-56.309,-74.45,0.827],[-49.749,-73.611,0.88],[-46.728,-72.444,0.94],[-45.192,-73.315,0.938],[-45.165,-73.254,0.938],[-46.196,-73.336,0.927],[-48.043,-73.614,0.92],[-49.858,-73.827,0.926],[-50.339,-74.159,0.918],[-49.844,-74.443,0.916],[-47.806,-73.666,0.936],[-46.506,-72.851,0.939],[-46.043,-73.274,0.939],[-45.734,-73.339,0.941],[-47.039,-74.104,0.993],[-48.387,-73.557,1.0],[-49.166,-74.193,1.0],[-49.746,-74.543,1.0],[-49.111,-74.025,1.0],[-48.456,-73.718,1.0],[-49.233,-73.606,1.0],[-49.926,-73.528,1.0],[-51.411,-73.509,1.0],[-51.697,-74.138,1.0],[-50.137,-73.842,1.0],[-48.449,-74.126,1.0],[-47.378,-74.01,1.0],[-48.441,-74.547,1.0],[-50.018,-73.421,1.0],[-52.266,-73.745,1.0],[-52.342,-73.853,1.0],[-50.059,-73.88,1.0],[-48.382,-74.229,1.0],[-47.531,-73.879,1.0],[-48.306,-73.945,1.0],[-48.112,-74.223,1.0],[-48.79,-74.577,1.0],[-50.096,-73.882,1.0],[-50.616,-73.794,1.0],[-50.01,-73.746,1.0],[-48.487,-73.148,1.0],[-46.883,-73.396,1.0],[-46.348,-73.356,1.0],[-45.927,-73.718,1.0],[-46.112,-74.248,1.0],[-47.821,-73.84,1.0],[-49.177,-74.316,1.0],[-50.589,-73.419,1.0],[-50.028,-73.657,1.0],[-48.67,-73.874,1.0],[-47.575,-74.404,1.0],[-46.849,-73.739,1.0],[-46.241,-73.725,1.0],[-46.546,-74.1,1.0],[-47.582,-74.231,1.0],[-50.576,-73.892,1.0],[-52.42,-74.53,1.0],[-53.838,-75.072,1.0],[-51.251,-74.444,1.0],[-48.182,-73.701,1.0],[-45.999,-73.932,1.0],[-45.078,-73.777,1.0],[-45.416,-73.791,1.0],[-46.069,-73.521,1.0],[-48.955,-73.834,1.0],[-52.393,-74.14,1.0],[-53.332,-73.927,0.985],[-49.045,-73.678,0.938],[-46.611,-74.36,0.926],[-45.156,-73.865,0.919],[-43.559,-73.946,0.925],[-43.075,-72.967,0.931],[-43.52,-74.163,0.912],[-44.838,-73.804,0.906],[-47.575,-74.162,0.905],[-49.911,-73.717,0.87],[-51.094,-75.387,0.861],[-47.959,-74.655,0.887],[-45.698,-74.798,0.908],[-44.342,-74.926,0.914],[-43.304,-74.351,0.927],[-43.272,-73.03,0.917],[-44.625,-73.942,0.909],[-46.654,-73.751,0.892],[-50.948,-74.581,0.853],[-54.498,-74.478,0.85],[-50.813,-74.96,0.868],[-47.518,-75.4,0.89],[-45.044,-74.863,0.913],[-43.43,-74.552,0.934],[-42.591,-72.738,0.932],[-44.012,-73.515,0.913],[-46.574,-74.084,0.879],[-50.705,-74.311,0.849],[-55.747,-74.794,0.839],[-53.812,-74.189,0.85],[-48.617,-73.899,0.883],[-45.518,-74.477,0.928],[-44.489,-73.624,0.918],[-44.306,-74.129,0.916],[-45.208,-73.162,0.903],[-47.668,-73.999,0.882],[-53.485,-73.627,0.828],[-59.509,-74.07,0.765],[-55.056,-74.358,0.805],[-48.686,-73.948,0.888],[-45.736,-74.078,0.879],[-44.07,-73.826,0.879],[-43.599,-73.615,0.904],[-44.087,-73.965,0.906],[-45.004,-73.432,0.911],[-48.884,-74.123,0.864],[-59.351,-74.374,0.803],[-54.581,-74.805,0.781],[-47.45,-75.211,null],[-75.456,-75.166,0.568],[-42.573,-74.664,0.738],[-41.693,-73.808,0.853],[-46.838,-73.995,null],[-43.5,-71.218,null],[null,-60.808,null],[null,-59.58,null],[null,-62.625,null],[-67.167